{
  "$schema": "https://json-schema.org/draft/2020-12/schema",
  "type": "object",
  "properties": {
    "schemaVersion": {
      "type": "number",
      "const": 1
    },
    "id": {
      "type": "string",
      "pattern": "^[a-z][a-z0-9-]*$"
    },
    "componentId": {
      "type": "string",
      "pattern": "^[a-z][a-z0-9-]*:[a-z][a-z0-9-]*$"
    },
    "team": {
      "type": "string",
      "minLength": 1
    },
    "application": {
      "type": "string",
      "minLength": 1
    },
    "issueUrl": {
      "type": "string",
      "format": "uri"
    },
    "decision": {
      "type": "string",
      "enum": [
        "approved-candidate",
        "use-existing",
        "app-specific",
        "rejected"
      ]
    },
    "owner": {
      "type": "string",
      "minLength": 1
    },
    "decidedBy": {
      "type": "string",
      "minLength": 1
    },
    "decidedAt": {
      "type": "string",
      "format": "date-time",
      "pattern": "^(?:(?:\\d\\d[2468][048]|\\d\\d[13579][26]|\\d\\d0[48]|[02468][048]00|[13579][26]00)-02-29|\\d{4}-(?:(?:0[13578]|1[02])-(?:0[1-9]|[12]\\d|3[01])|(?:0[469]|11)-(?:0[1-9]|[12]\\d|30)|(?:02)-(?:0[1-9]|1\\d|2[0-8])))T(?:(?:[01]\\d|2[0-3]):[0-5]\\d:[0-5]\\d(?:\\.\\d+)?(?:Z))$"
    },
    "decisionUrl": {
      "type": "string",
      "format": "uri"
    },
    "note": {
      "type": "string",
      "minLength": 1
    }
  },
  "required": [
    "schemaVersion",
    "id",
    "componentId",
    "team",
    "application",
    "issueUrl",
    "decision",
    "owner",
    "decidedBy",
    "decidedAt",
    "decisionUrl",
    "note"
  ],
  "additionalProperties": false,
  "$id": "urn:plectrum:schema:proposal:1"
}
